sku,name,category,tags,weather_suitability,price,colors,layering,formality,description
SKU017,Retail Gen AI Hackathon Hoodie,Outerwear,"casual, warm, branded",cold,60,charcoal,outer,casual,"Cozy hoodie featuring Retail Gen AI Hackathon and ALDO branding, ideal for cooler weather and casual wear."
SKU018,Missoni Striped Knit Top,Topwear,"colorful, patterned, designer",warm,250,multicolor,base,smart-casual,"Vibrant multicolor striped knit top with thin straps, perfect for stylish summer outings."
SKU019,Crystal Embellished Tank Top,Topwear,"sparkly, elegant, lightweight",warm,120,ivory,base,formal,"Elegant ivory tank top with crystal embellishments, great for parties or layered under a blazer."
SKU020,Lilac Quote T-Shirt,Topwear,"graphic, casual, cotton",warm,35,lavender,base,casual,Soft lavender cotton T-shirt with the quote 'What would you do without me?' printed on the front.
SKU021,Adidas Samba OG Shoes,Footwear,"sporty, classic, leather",mild,120,"black, white",footwear,casual,"Timeless Adidas Samba OG sneakers with black leather and white stripes, versatile for everyday wear."
SKU022,Classic Denim Shorts,Bottomwear,"casual, summer, denim",warm,50,blue,base,casual,"Classic blue denim shorts for casual and summer wear, featuring a mid-rise fit and sturdy cotton fabric."
